{
  "schema_version": "w2.collection.v1",
  "command_id": "00000000-0000-4000-8000-000000000205",
  "job_id": "00000000-0000-4000-8000-000000000202",
  "input_version": 1,
  "result_version": 2,
  "successful_source_refs": [{
    "source_id": "00000000-0000-4000-8000-000000000101",
    "source_version_id": "00000000-0000-4000-8000-000000000102",
    "extraction_revision_id": "00000000-0000-4000-8000-000000000103"
  }],
  "failures": [{
    "source_id": "00000000-0000-4000-8000-000000000101",
    "stage": "parse",
    "code": "MISSING_REQUIRED_SECTION",
    "missing_sections": ["preferred_qualifications"],
    "impact": "The source needs an explicit retry decision.",
    "core_decision_revision": 3
  }],
  "completion_kind": "partial",
  "resume_stage": "fetch",
  "checkpoint_ref": "fetch:checkpoint-0001",
  "retry_not_before": null,
  "message_ko": "일부 항목을 수집했고 재시도 결정이 필요합니다.",
  "required_actions": [{
    "code": "user_retry",
    "label_ko": "재시도",
    "context": {
      "source_id": "00000000-0000-4000-8000-000000000101",
      "resume_stage": "fetch",
      "retry_not_before": null
    }
  }],
  "source_id": "00000000-0000-4000-8000-000000000101",
  "policy_revision": 4
}
